{
  "version": "POINTS_MAP_V1",
  "collection_id": "4f4c447b-66c4-48de-bc27-4e6900176500",
  "total_supply": 100,
  "point_distribution": {
    "buckets": {
      "10": { "points": 10, "count": 10 },
      "9": { "points": 9, "count": 10 },
      "8": { "points": 8, "count": 10 },
      "7": { "points": 7, "count": 10 },
      "6": { "points": 6, "count": 10 },
      "5": { "points": 5, "count": 10 },
      "4": { "points": 4, "count": 10 },
      "3": { "points": 3, "count": 10 },
      "2": { "points": 2, "count": 10 },
      "1": { "points": 1, "count": 10 }
    },
    "totals": {
      "card_count": 100,
      "weighted_points": 550
    }
  },
  "validation": {
    "card_count_matches_supply": true,
    "no_empty_buckets": true,
    "weighted_total_valid": true
  }
}